,status,totalResults,articles
27,ok,926,"{'source': {'id': None, 'name': 'The Guardian'}, 'author': 'Siva Vaidhyanathan', 'title': 'So the government’s antitrust lawsuit against Facebook failed. Where now? | Siva Vaidhyanathan', 'description': 'It turns out that Facebook is more powerful and resilient – and American antitrust law less helpful – than critics of Big Tech had hopedWithin 12 hours of a federal judge tossing out a state and federal antitrust lawsuits against Facebook, the market value of…', 'url': 'https://amp.theguardian.com/commentisfree/2021/jun/30/facebook-antitrust-lawsuit-big-tech', 'urlToImage': 'https://i.guim.co.uk/img/media/a7133c63c67ac520cbc639265cdae97a9a0238f8/0_240_3600_2160/master/3600.jpg?width=1200&height=630&quality=85&auto=format&fit=crop&overlay-align=bottom%2Cleft&overlay-width=100p&overlay-base64=L2ltZy9zdGF0aWMvb3ZlcmxheXMvdGctb3BpbmlvbnMucG5n&enable=upscale&s=f5bf84e890518deb56a6981b23fd7958', 'publishedAt': '2021-06-30T10:14:36Z', 'content': 'Within 12 hours of a federal judge tossing out a state and federal antitrust lawsuits against Facebook, the market value of the adolescent company exceeded $1tn. Facebook became the fifth company wor… [+5567 chars]'}"
28,ok,926,"{'source': {'id': 'techcrunch', 'name': 'TechCrunch'}, 'author': 'Natasha Lomas', 'title': 'InfoSum outs an identity linking tool that’s exciting marketing firms like Experian', 'description': 'InfoSum, a startup which takes a federated approach to third party data enrichment, has launched a new product (called InfoSum Bridge) that it says significantly expands the customer identity linking capabilities of its platform. “InfoSum Bridge incorporates …', 'url': 'http://techcrunch.com/2021/06/10/infosum-outs-an-identity-linking-tool-thats-exciting-marketing-firms-like-experian/', 'urlToImage': 'https://techcrunch.com/wp-content/uploads/2021/05/GettyImages-1289822124.jpg?w=600', 'publishedAt': '2021-06-10T14:49:55Z', 'content': 'InfoSum, a startup which takes a federated approach to third party data enrichment, has launched a new product (called InfoSum Bridge) that it says significantly expands the customer identity linking… [+8724 chars]'}"
29,ok,926,"{'source': {'id': None, 'name': 'Vox'}, 'author': 'Shirin Ghaffary', 'title': 'Big Tech has a battle ahead over antitrust regulation — and it’s going to get messy', 'description': 'Industry groups are ramping up their fight against regulation.', 'url': 'https://www.vox.com/recode/22537529/tech-battle-antitrust-regulation-lina-khan-ftc-google-facebook-apple-amazon-cicilline-congress', 'urlToImage': 'https://cdn.vox-cdn.com/thumbor/eP5UyGXiRduuaS4dC-lqaxkDF2k=/0x0:5162x2703/fit-in/1200x630/cdn.vox-cdn.com/uploads/chorus_asset/file/22666245/1232440122.jpg', 'publishedAt': '2021-06-18T11:30:00Z', 'content': 'Lina Khan, who has been a strong advocate for breaking up Big Tech companies, was recently appointed as chair of the FTC. | Saul Loeb/AFP via Getty Images\r\n\n \n\n Industry groups are ramping up their f… [+9104 chars]'}"
30,ok,926,"{'source': {'id': 'cnn', 'name': 'CNN'}, 'author': 'Rob Picheta, CNN', 'title': 'Few Israelis wanted a leader to the right of Netanyahu. Naftali Bennett is set to oust his old boss anyway', 'description': ""If Naftali Bennett becomes Israel's leader, he will carry into office a history of incendiary remarks about Palestinians and a well-documented ambition to annex part of the occupied West Bank."", 'url': 'https://www.cnn.com/2021/06/04/middleeast/naftali-bennett-israel-profile-intl-cmd/index.html', 'urlToImage': 'https://cdn.cnn.com/cnnnext/dam/assets/210604094451-naftali-bennett-selfie-03-17-2021-super-tease.jpg', 'publishedAt': '2021-06-04T10:45:03Z', 'content': ""(CNN)After the 2019 elections, Naftali Bennett's right-wing party failed to cross the electoral threshold and had no seats in Israel's parliament. \r\nTwo years later, he's on the verge of becoming the… [+6776 chars]""}"
31,ok,926,"{'source': {'id': 'reuters', 'name': 'Reuters'}, 'author': 'Oliver Taslic', 'title': 'Review: Reining in the crypto-fanatics - Reuters', 'description': '“If I try to articulate every little detail,” Jeff Koons once commented, “it would be like missing the forest for the trees.” The American sculptor’s words come to mind while reading “The Pay Off: How Changing the Way We Pay Changes Everything”. It’s an other…', 'url': 'https://www.reuters.com/breakingviews/review-reining-crypto-fanatics-2021-06-25/', 'urlToImage': 'https://www.reuters.com/resizer/SJC_IqhJaM3cCxYQCEawZUw0dmQ=/1200x628/smart/filters:quality(80)/cloudfront-us-east-2.images.arcpublishing.com/reuters/GFQYYHX3CZMCTDINJ357YW4L2I.jpg', 'publishedAt': '2021-06-25T13:28:00Z', 'content': 'Employees use an iPhone to demonstrate the Apple Pay service at a store in Beijing, China, February 17, 2016. REUTERS/Damir SagoljLONDON, June 25 (Reuters Breakingviews) - If I try to articulate ever… [+5959 chars]'}"
32,ok,926,"{'source': {'id': 'the-verge', 'name': 'The Verge'}, 'author': 'Nilay Patel', 'title': 'Juul and the business of addiction', 'description': 'Nilay Patel talks to Bloomberg reporter Lauren Etter about her book The Devil’s Playbook, and how e-cigarette company Juul accidentally fostered an underage smoking epidemic while beating tobacco companies at their own game.', 'url': 'https://www.theverge.com/22554477/juul-lauren-etter-interview-e-cigarettes-addiction', 'urlToImage': 'https://cdn.vox-cdn.com/thumbor/iVlbpfy5Ga8dCuux888wSfwbtgY=/0x148:2050x1221/fit-in/1200x630/cdn.vox-cdn.com/uploads/chorus_asset/file/22687438/VRG_ILLO_4652_Decoder_Lauren_Etter_s.jpg', 'publishedAt': '2021-06-29T20:55:33Z', 'content': 'Photo Illustration by Grayson Blackmon / The Verge\r\n\n \n\n\n Bloomberg’s Lauren Etter on the rise and decline of an e-cigarette upstart Several years ago, I went to a splashy launch party for a new tech… [+61682 chars]'}"
33,ok,926,"{'source': {'id': None, 'name': 'Yahoo Entertainment'}, 'author': 'Rob Lever', 'title': 'Lawmakers take first step toward Big Tech regulation...', 'description': 'Lawmakers take first step toward Big Tech regulation...\r\n\n \n \n \n (Third column, 5th story, link)\r\n\n \r\n\n \r\n\n \n \n Drudge Report Feed needs your support!\xa0\xa0 Become a Patron', 'url': 'https://news.yahoo.com/us-lawmakers-first-step-toward-012159187.html', 'urlToImage': 'https://s.yimg.com/uu/api/res/1.2/kHu6.dKhdF_hSNCGxqFjxA--~B/aD01MTg7dz03Njg7YXBwaWQ9eXRhY2h5b24-/https://media.zenfs.com/en/afp.com/b8ebe2d8c2693248bc49af3353ec868b', 'publishedAt': '2021-06-23T02:52:39Z', 'content': 'US lawmakers take a first step toward regulating Big Tech on Wednesday with a vote on a series of bills with potentially massive implications for large online platforms and consumers who use them.\r\nT… [+4047 chars]'}"
34,ok,926,"{'source': {'id': None, 'name': 'New York Times'}, 'author': 'Shira Ovide', 'title': 'China Isn’t the Issue. Big Tech Is.', 'description': 'Don’t be distracted by the fearmongering.', 'url': 'https://www.nytimes.com/2021/06/17/technology/china-big-tech.html', 'urlToImage': 'https://static01.nyt.com/images/2021/06/17/business/17OnTech-China/17OnTech-China-facebookJumbo-v2.jpg', 'publishedAt': '2021-06-17T17:20:48Z', 'content': 'But powerful corporations and people who support them arent grappling with the nuances. Publicly at least, they have responded as they often do, by essentially implying that guardrails on some U.S. t… [+1217 chars]'}"
35,ok,926,"{'source': {'id': None, 'name': '9to5Mac'}, 'author': 'Michael Potuck', 'title': 'App Store could be hit by proposed ‘Ending Platform Monopolies Act’ in US House', 'description': 'Fresh details have surfaced on new legislation that could be proposed in the US House of Representatives as soon as today that’s set to take on the likes of Apple, Amazon, Google, and Facebook. Called the Ending Platform Monopolies Act, the proposal contains …', 'url': 'https://9to5mac.com/2021/06/11/app-store-could-be-hit-by-ending-monopolies-act/', 'urlToImage': 'https://i2.wp.com/9to5mac.com/wp-content/uploads/sites/6/2016/03/congress.jpg?resize=1200%2C628&quality=82&strip=all&ssl=1', 'publishedAt': '2021-06-11T16:07:55Z', 'content': 'Fresh details have surfaced on new legislation that could be proposed in the US House of Representatives as soon as today that’s set to take on the likes of Apple, Amazon, Google, and Facebook. Calle… [+1591 chars]'}"
36,ok,926,"{'source': {'id': None, 'name': 'New York Times'}, 'author': 'Shira Ovide', 'title': 'What Congress Wants From Big Tech', 'description': 'House lawmakers have gotten serious. A package of bills poses existential threats to the tech giants.', 'url': 'https://www.nytimes.com/2021/06/24/technology/congress-big-tech.html', 'urlToImage': 'https://static01.nyt.com/images/2021/06/24/business/24OnTech-Kang/24OnTech-Kang-facebookJumbo.jpg', 'publishedAt': '2021-06-24T16:15:10Z', 'content': 'That helped to cement a mostly bipartisan consensus although not always for shared reasons that Washington needed to be less hands-off with technology companies. And antitrust law is now perceived as… [+1992 chars]'}"
37,ok,926,"{'source': {'id': None, 'name': 'Unherd.com'}, 'author': 'Tom Chivers', 'title': 'Are TWITTER trolls mentally ill?', 'description': ""Are TWITTER trolls mentally ill?\r\n\n \n \n \n (Third column, 8th story, link)\r\n\n \r\n\n \r\n\n \n Related stories:Cook called Pelosi with 'warning' about antitrust bills...\r\nLawmakers take serious step toward Big Tech regulation..."", 'url': 'http://unherd.com/2021/06/are-twitter-trolls-mentally-ill/', 'urlToImage': 'https://unherd.com/wp-content/uploads/2021/06/GettyImages-1200752909-scaled-e1624446042705-1.jpg', 'publishedAt': '2021-06-23T15:52:37Z', 'content': 'Theres a thing in the ethics of psychology called the Goldwater Rule. It states, in essence, that mental health professionals should not diagnose people from afar. It arose in the 1964 US presidentia… [+10285 chars]'}"
38,ok,926,"{'source': {'id': None, 'name': 'New York Times'}, 'author': 'Charlotte Cowles', 'title': 'The Week in Business: Here Come the Trustbusters', 'description': 'One of big tech’s top critics is now in charge of its regulation at the F.T.C.', 'url': 'https://www.nytimes.com/2021/06/20/business/the-week-in-business-tech-critics.html', 'urlToImage': 'https://static01.nyt.com/images/2021/06/18/business/18with-interest/18with-interest-facebookJumbo.jpg', 'publishedAt': '2021-06-20T11:00:04Z', 'content': 'And just like that, the 17-year trade dispute between the United States and the European Union over aircraft subsidies was resolved at least temporarily. The two sides agreed to suspend threats of pu… [+2270 chars]'}"
39,ok,926,"{'source': {'id': None, 'name': 'MarketWatch'}, 'author': 'Eric Posner', 'title': 'Project Syndicate: What’s the goal: Democracy or efficiency? How to understand the impassioned debate over Big Tech and antitrust', 'description': 'Two strains in antitrust thought clash over what to do about the political and economic dominance of large companies and their owners.', 'url': 'https://www.marketwatch.com/story/whats-the-goal-democracy-or-efficiency-how-to-understand-the-impassioned-debate-over-big-tech-and-antitrust-11624384675', 'urlToImage': 'https://images.mktw.net/im-357850/social', 'publishedAt': '2021-06-22T17:57:00Z', 'content': 'CHICAGO (Project Syndicate)With the prominent antimonopoly advocate Lina Khan having been appointed the new chair of the Federal Trade Commission, it is a good time to consider what influence the so-… [+7418 chars]'}"
40,ok,926,"{'source': {'id': None, 'name': 'Avc.com'}, 'author': 'Fred Wilson', 'title': 'Digital Asset Mining In New York State', 'description': 'Digital Asset Mining is shorthand for “proof of work consensus validation of public blockchain infrastructure”. Thankfully we have the shorthand. But it is important to understand what digital asset mining is. Public blockchains, like Bitcoin and Ethereum, st…', 'url': 'https://avc.com/2021/06/digital-asset-mining-in-new-york-state/', 'urlToImage': None, 'publishedAt': '2021-06-08T12:09:20Z', 'content': 'Digital Asset Mining is shorthand for “proof of work consensus validation of public blockchain infrastructure”. Thankfully we have the shorthand. But it is important to understand what digital asset … [+3140 chars]'}"
41,ok,926,"{'source': {'id': None, 'name': 'MacRumors'}, 'author': 'Juli Clover', 'title': ""Apple CEO Tim Cook: Sideloading Apps Would 'Destroy the Security' of the iPhone"", 'description': ""Apple CEO Tim Cook this morning participated in a virtual interview at the VivaTech conference, which is described as Europe's biggest startup and tech event. Cook was interviewed by Guillaume Lacroix, CEO and founder of Brut, a media company that creates sho…"", 'url': 'https://www.macrumors.com/2021/06/16/tim-cook-vivatech-conference-interview/', 'urlToImage': 'https://images.macrumors.com/t/Zt1v7fLFwE8snmKq8uEjjAcurmU=/1600x/https://images.macrumors.com/article-new/2021/06/tim-cook-brut.jpg', 'publishedAt': '2021-06-16T17:49:44Z', 'content': ""Apple CEO Tim Cook this morning participated in a virtual interview at the VivaTech conference, which is described as Europe's biggest startup and tech event. Cook was interviewed by Guillaume Lacroi… [+7327 chars]""}"
42,ok,926,"{'source': {'id': 'techcrunch', 'name': 'TechCrunch'}, 'author': 'Walter Thompson', 'title': 'Extra Crunch roundup: Unpacking BuzzFeed’s SPAC, curb your meeting enthusiasm, more', 'description': 'There\'s a kernel of truth in every joke, so whenever someone quips, ""This meeting could have been an email!"" you can bet that some small part of them meant it sincerely.', 'url': 'http://techcrunch.com/2021/06/25/extra-crunch-roundup-unpacking-buzzfeeds-spac-curb-your-meeting-enthusiasm-more/', 'urlToImage': 'https://techcrunch.com/wp-content/uploads/2021/06/GettyImages-1325347467.jpg?w=600', 'publishedAt': '2021-06-25T21:39:27Z', 'content': 'Meetings should have a clear purpose, but instead, they’ve become a way to measure status and reinforce what is colloquially referred to as CYA culture.\r\nThere’s a kernel of truth in every joke, so w… [+11458 chars]'}"
43,ok,926,"{'source': {'id': 'reuters', 'name': 'Reuters'}, 'author': 'Simon Jessop,Sujata Rao', 'title': 'Analysis: Planned global tax raid catches ethical investor zeitgeist - Reuters', 'description': ""A global tax crackdown on multinationals has the backing of some of the world's biggest investors who say that using low-tax jurisdictions falls foul of the tenets they have committed to."", 'url': 'https://www.reuters.com/business/planned-global-tax-raid-catches-ethical-investor-zeitgeist-2021-06-02/', 'urlToImage': 'https://www.reuters.com/resizer/gxyq_oL5Sp4jD3Ybs4tGWe8VOjU=/1200x628/smart/filters:quality(80)/cloudfront-us-east-2.images.arcpublishing.com/reuters/KRTNS6VT3RIYPDFB64IVWJTVBQ.jpg', 'publishedAt': '2021-06-02T10:42:00Z', 'content': ""A global tax crackdown on multinationals has the backing of some of the world's biggest investors who say that using low-tax jurisdictions falls foul of the tenets they have committed to.\r\nAfter year… [+5557 chars]""}"
44,ok,926,"{'source': {'id': None, 'name': 'MarketWatch'}, 'author': 'Jon Swartz', 'title': ': House Democrats set to reshape antitrust law with 5 new bills', 'description': 'House Democrats led by Rep. David Cicilline, D-R.I., reportedly are poised to introduce a package of five bills to shake up the U.S. antitrust climate. The most aggressive would let prosecutors sue to break up major tech companies by forcing the platforms to …', 'url': 'https://www.marketwatch.com/story/house-democrats-set-to-reshape-antitrust-law-with-5-new-bills-11623356069', 'urlToImage': 'https://images.mktw.net/im-336174/social', 'publishedAt': '2021-06-10T20:14:00Z', 'content': 'Some of Big Techs fiercest critics are about to put legislation behind their words.House Democrats, led by Rep. David Cicilline of Rhode Island, reportedly are poised to introduce a package of five b… [+2424 chars]'}"
45,ok,926,"{'source': {'id': None, 'name': 'MarketWatch'}, 'author': 'Jon Swartz', 'title': ': The Empire Strikes Back: Tech giants mount defense against House antitrust bills', 'description': 'Representatives from Apple Inc., Facebook Inc., and Amazon.com Inc. --- targets of bills that would severely hinder their ability to acquire smaller rivals, disrupt their digital platforms, and potentially break up their companies --- warned the legislation w…', 'url': 'https://www.marketwatch.com/story/the-empire-strikes-back-tech-giants-mount-defense-against-house-antitrust-bills-11624465285', 'urlToImage': 'https://images.mktw.net/im-336174/social', 'publishedAt': '2021-06-23T16:21:00Z', 'content': 'Before the House Judiciary Committee on Wednesday began to consider a package of antitrust bills that represent the gravest threat yet to Silicon Valleys power, the Big Tech Empire struck back.Repres… [+6163 chars]'}"
46,ok,926,"{'source': {'id': None, 'name': 'AppleInsider'}, 'author': 'news@appleinsider.com (Mike Peterson)', 'title': 'House antitrust legislation has more bark than bite, analyst says', 'description': ""Despite a slate of sweeping antitrust bills in the U.S., investment bank Wedbush believes there's no major threat to the structure of most large technology companies like Apple.Credit: WikiMedia CommonsIn a note to investors seen by AppleInsider, lead Wedbush…"", 'url': 'https://appleinsider.com/articles/21/06/22/house-antitrust-legislation-has-more-bark-than-bite-analyst-says', 'urlToImage': 'https://photos5.appleinsider.com/gallery/42750-83004-Apple-Logo-on-Building-xl.jpg', 'publishedAt': '2021-06-22T13:58:11Z', 'content': ""Despite a slate of sweeping antitrust bills in the U.S., investment bank Wedbush believes there's no major threat to the structure of most large technology companies like Apple.\r\nIn a note to investo… [+3101 chars]""}"
47,ok,926,"{'source': {'id': None, 'name': 'Theregister.com'}, 'author': 'Matt Dupuy', 'title': 'Cross-discipline boffin dream team issues social media warning: FIX IT NOW!', 'description': 'Concerned researchers suggest some form of subtle regulation to prevent end of humanity as we know it\nA group of 17 researchers from a wide cross-section of different disciplines have come together to contribute to a paper suggesting social media might be a r…', 'url': 'https://www.theregister.com/2021/06/30/social_media_end_of_humanity/', 'urlToImage': 'https://regmedia.co.uk/2015/05/21/atomic_explosion_cloud.jpg', 'publishedAt': '2021-06-30T08:32:04Z', 'content': ""A group of 17 researchers from a wide cross-section of different disciplines have come together to contribute to a paper suggesting social media might be a risk to humanity's continued existence as w… [+3829 chars]""}"
48,ok,926,"{'source': {'id': None, 'name': 'MIT Technology Review'}, 'author': 'MIT Technology Review Insights', 'title': 'Taxing digital advertising could help break up big tech', 'description': 'For the past several years, economists, and government leaders have regularly sounded alarms about the dangers of big tech monopolies. On her 2020 campaign website, for example, Senator Elizabeth Warren said “big tech companies have too much power, too much p…', 'url': 'https://www.technologyreview.com/2021/06/14/1026207/taxing-digital-advertising-could-help-break-up-big-tech/', 'urlToImage': 'https://wp.technologyreview.com/wp-content/uploads/2021/06/Paul-Romer-Episode-Page-Header.png?resize=1200,600', 'publishedAt': '2021-06-14T16:58:57Z', 'content': 'For the past several years, economists, and government leaders have regularly sounded alarms about the dangers of big tech monopolies. On her 2020 campaign website, for example, Senator Elizabeth War… [+30228 chars]'}"
49,ok,926,"{'source': {'id': None, 'name': 'VentureBeat'}, 'author': 'Contributor', 'title': 'Business leaders need to map out strategies for the next five years', 'description': 'Shrewd business leaders need to imagine what the next five years would look like and create strategies to accomplish those goals.', 'url': 'https://venturebeat.com/2021/06/09/business-leaders-need-to-map-out-strategies-for-the-next-five-years/', 'urlToImage': 'https://venturebeat.com/wp-content/uploads/2021/06/GettyImages-1128201585-1-1-e1623141314309.jpg?w=1200&strip=all', 'publishedAt': '2021-06-09T07:43:04Z', 'content': 'Elevate your enterprise data technology and strategy at Transform 2021. \r\nThis post was written by Doug Randall, a CEO coach at the Trium Group.\r\nAlthough the global crisis is far from over, its time… [+8245 chars]'}"
50,ok,926,"{'source': {'id': 'abc-news', 'name': 'ABC News'}, 'author': 'Ashan Singh, Laura Coburn, Jessica Hopper, Allie Yang', 'title': 'As legal marijuana booms, people push for justice for those impacted by war on drugs', 'description': 'As more states legalize, some are concerned that big business will dominate the industry and that those impacted by the previous laws won’t get a second chance.', 'url': 'https://abcnews.go.com/US/legal-marijuana-booms-people-push-justice-impacted-war/story?id=78028117', 'urlToImage': 'https://s.abcnews.com/images/US/marijuana-1-gty-er-210601_1622584926346_hpMain_16x9_992.jpg', 'publishedAt': '2021-06-03T01:05:34Z', 'content': 'In 2001, Harry Kelso left his hometown of Roanoke, Virginia, for the big city of Richmond and the promise of an education at Virginia Union University.\r\nI was gonna go to school and get my degree and… [+13512 chars]'}"
51,ok,926,"{'source': {'id': None, 'name': 'Forbes'}, 'author': 'Enrique Dans, Senior Contributor, \n Enrique Dans, Senior Contributor\n https://www.forbes.com/sites/enriquedans/', 'title': 'Congress Rolls Out Some Tough Regulatory Proposals For Big Tech', 'description': 'A group of House Democrats, supported by a few Republicans\u200a—\u200aunusual in a deeply divided Congress\u200a—\u200ais introducing five bills that would impose tough regulation of big tech.', 'url': 'https://www.forbes.com/sites/enriquedans/2021/06/12/congress-rolls-out-some-tough-regulatory-proposals-for-big-tech/', 'urlToImage': 'https://thumbor.forbes.com/thumbor/fit-in/1200x0/filters%3Aformat%28jpg%29/https%3A%2F%2Fspecials-images.forbesimg.com%2Fimageserve%2F60c47f902ab5c19d5148fbed%2F0x0.jpg%3FcropX1%3D0%26cropX2%3D2376%26cropY1%3D415%26cropY2%3D1529', 'publishedAt': '2021-06-12T09:49:04Z', 'content': 'IMAGE:\r\ngetty\r\nA group of House Democrats, supported by a few Republicansunusual in a deeply divided Congressis introducing five bills that would impose tough regulation of big tech.\r\nThe bills inclu… [+3269 chars]'}"
52,ok,926,"{'source': {'id': None, 'name': 'Washington Examiner'}, 'author': 'https://www.washingtonexaminer.com/author/nihal-krishan', 'title': ""'The Ending Platform Monopolies Act'..."", 'description': ""'The Ending Platform Monopolies Act'...\r\n\n \n \n \n (Third column, 8th story, link)\r\n\n \r\n\n \r\n\n \n Related stories:Cook called Pelosi with 'warning' about antitrust bills...\r\nLawmakers take serious step toward Big Tech regulation...\r\nAre TWITTER trolls mentally il…"", 'url': 'https://www.washingtonexaminer.com/news/apple-apps-google-search-amazon-basics-drastic-changes-bipartisan-house-antitrust-bill-jayapal', 'urlToImage': 'https://mediadc.brightspotcdn.com/dims4/default/4c8045a/2147483647/strip/true/crop/2061x1082+0+155/resize/1200x630!/quality/90/?url=http%3A%2F%2Fmediadc-brightspot.s3.amazonaws.com%2Fcb%2F96%2F604a94064095b57a74782d2af360%2Fap20331632786335.jpg', 'publishedAt': '2021-06-23T16:34:38Z', 'content': 'A new antitrust bill aimed at reducing conflicts of interest on online marketplaces could drastically decrease Big Tech companies giving preference to their own products and services and potentially … [+4154 chars]'}"
53,ok,926,"{'source': {'id': 'techcrunch', 'name': 'TechCrunch'}, 'author': 'Natasha Lomas', 'title': 'CJEU ruling could open big tech to more privacy litigation in Europe', 'description': ""A long running privacy fight between Belgium's data protection authority and Facebook -- over the latter's use of online trackers like pixels and social plug..."", 'url': 'https://techcrunch.com/2021/06/15/cjeu-ruling-could-open-big-tech-to-more-privacy-litigation-in-europe/', 'urlToImage': 'https://s.yimg.com/uu/api/res/1.2/wFA6rVDbrcsr532WylVVkg--~B/aD05MDA7dz0xNjAwO2FwcGlkPXl0YWNoeW9u/https://media.zenfs.com/en/techcrunch_350/37208dec77d9fd8319cf0ed0d4b0f13d', 'publishedAt': '2021-06-15T12:57:31Z', 'content': ""A long running privacy fight between Belgium's data protection authority and Facebook -- over the latter's use of online trackers like pixels and social plug-ins to snoop on web users -- has culminat… [+6954 chars]""}"
54,ok,926,"{'source': {'id': None, 'name': 'The Intercept'}, 'author': 'Zach Campbell, Caitlin L. Chandler', 'title': 'Tools for Repression in Myanmar Expose Gap Between EU Tech Investment and Regulation', 'description': 'Europe is developing phone-cracking technology with a company that has exported to authoritarian regimes.\nThe post Tools for Repression in Myanmar Expose Gap Between EU Tech Investment and Regulation appeared first on The Intercept.', 'url': 'https://theintercept.com/2021/06/14/myanmar-msab-eu-technology-regulation/', 'urlToImage': 'https://theintercept.imgix.net/wp-uploads/sites/1/2021/06/theintercept-myanmar-feature.jpg?auto=compress%2Cformat&q=90&fit=crop&w=1200&h=800', 'publishedAt': '2021-06-14T17:30:21Z', 'content': 'Inside the interrogation\r\n room of a Myanmar detention center, what Myat remembers most clearly is looking up from the floor and everything being green. The officials questioning him sat on green pla… [+17937 chars]'}"
