,status,totalResults,articles
0,ok,926,"{'source': {'id': 'techcrunch', 'name': 'TechCrunch'}, 'author': 'Natasha Lomas', 'title': 'CJEU ruling could open big tech to more privacy litigation in Europe', 'description': 'A long running privacy fight between Belgium’s data protection authority and Facebook — over the latter’s use of online trackers like pixels and social plug-ins to snoop on web users — has culminated in a ruling by Europe’s top court today that could have wid…', 'url': 'http://techcrunch.com/2021/06/15/cjeu-ruling-could-open-big-tech-to-more-privacy-litigation-in-europe/', 'urlToImage': 'https://techcrunch.com/wp-content/uploads/2015/11/data-privacy-law.png?w=711', 'publishedAt': '2021-06-15T12:57:31Z', 'content': 'A long running privacy fight between Belgium’s data protection authority and Facebook — over the latter’s use of online trackers like pixels and social plug-ins to snoop on web users — has culminated… [+6936 chars]'}"
1,ok,926,"{'source': {'id': 'techcrunch', 'name': 'TechCrunch'}, 'author': 'Manish Singh', 'title': 'India’s central bank says growing presence of Big Tech in financial services a concern', 'description': 'India’s central bank has identified Big Tech’s push into financial services as a challenge for banks in the South Asian market, saying the growing presence of these firms have prompted concerns about creation of an uneven playing field. In a report published …', 'url': 'http://techcrunch.com/2021/07/01/indias-central-bank-says-growing-presence-of-big-tech-in-financial-services-a-concern/', 'urlToImage': 'https://techcrunch.com/wp-content/uploads/2021/07/GettyImages-1232704144.jpg?w=601', 'publishedAt': '2021-07-01T18:57:10Z', 'content': 'Indias central bank has identified Big Tech’s push into financial services as a challenge for banks in the South Asian market, saying the growing presence of these firms have prompted concerns about … [+3230 chars]'}"
2,ok,926,"{'source': {'id': 'the-verge', 'name': 'The Verge'}, 'author': 'Jon Porter', 'title': 'Google to work with UK regulators on its big ad-tracking shakeup', 'description': 'The UK’s competition regulator, the Competition and Markets Authority, is collaborating with Google on its Privacy Sandbox. This is the replacement for third-party cookies that Google is proposing.', 'url': 'https://www.theverge.com/2021/6/14/22532862/google-uk-regulator-competition-and-markets-authority-privacy-sandbox-floc', 'urlToImage': 'https://cdn.vox-cdn.com/thumbor/8prPqvLDLzqWV7wMDohjR2zgctU=/0x146:2040x1214/fit-in/1200x630/cdn.vox-cdn.com/uploads/chorus_asset/file/10745893/acastro_180427_1777_0003.jpg', 'publishedAt': '2021-06-14T08:50:52Z', 'content': 'Decision comes after company investigated by the UKs Competition and Markets Authority\r\nIllustration: Alex Castro / The Verge\r\nThe UKs competition regulator, the Competition and Markets Authority (CM… [+2310 chars]'}"
3,ok,926,"{'source': {'id': 'techcrunch', 'name': 'TechCrunch'}, 'author': 'Taylor Hatmaker', 'title': 'A Senate proposal for a new US agency to protect Americans’ data is back', 'description': 'Democratic Senator Kirsten Gillibrand has revived a bill that would establish a new U.S. federal agency to shield Americans from the invasive practices of tech companies operating in their own backyard. Last year, Gillibrand (D-NY) introduced the Data Protect…', 'url': 'http://techcrunch.com/2021/06/17/data-protection-agency-bill-antitrust-gillibrand/', 'urlToImage': 'https://techcrunch.com/wp-content/uploads/2019/08/GettyImages-654212048.jpg?w=600', 'publishedAt': '2021-06-17T10:00:05Z', 'content': 'Democratic Senator Kirsten Gillibrand has revived a bill that would establish a new U.S. federal agency to shield Americans from the invasive practices of tech companies operating in their own backya… [+3094 chars]'}"
4,ok,926,"{'source': {'id': 'techcrunch', 'name': 'TechCrunch'}, 'author': 'Richard Dal Porto', 'title': 'Daily Crunch: With Wickr purchase, AWS enters the encrypted messaging business', 'description': 'Hello friends and welcome to Daily Crunch, bringing you the most important startup, tech and venture capital news in a single package.', 'url': 'http://techcrunch.com/2021/06/25/daily-crunch-with-wickr-purchase-aws-enters-the-encrypted-messaging-business/', 'urlToImage': 'https://techcrunch.com/wp-content/uploads/2020/11/GettyImages-1180091997.jpg?w=600', 'publishedAt': '2021-06-25T22:10:15Z', 'content': 'To get a roundup of TechCrunchs biggest and most important stories delivered to your inbox every day at 3 p.m. PDT, subscribe here.\r\nHello and welcome to Daily Crunch for June 25, 2021. We have a gre… [+5505 chars]'}"
5,ok,926,"{'source': {'id': 'techcrunch', 'name': 'TechCrunch'}, 'author': 'Richard Dal Porto', 'title': 'Daily Crunch: After quarters of explosive growth, a profitable Robinhood files to go public', 'description': 'Hello friends and welcome to Daily Crunch, bringing you the most important startup, tech and venture capital news in a single package.', 'url': 'http://techcrunch.com/2021/07/01/daily-crunch-after-quarters-of-explosive-growth-a-profitable-robinhood-files-to-go-public/', 'urlToImage': 'https://techcrunch.com/wp-content/uploads/2021/01/robinhood-brick-wall.jpg?w=711', 'publishedAt': '2021-07-01T22:10:44Z', 'content': 'To get a roundup of TechCrunchs biggest and most important stories delivered to your inbox every day at 3 p.m. PDT, subscribe here.\r\nHello and welcome to Daily Crunch for July 1, 2021. Its Robinood I… [+7452 chars]'}"
6,ok,926,"{'source': {'id': 'techcrunch', 'name': 'TechCrunch'}, 'author': 'Natasha Lomas', 'title': 'UK’s ICO warns over ‘big data’ surveillance threat of live facial recognition in public', 'description': 'The UK’s chief data protection regulator has warned over reckless and inappropriate use of live facial recognition (LFR) in public places. Publishing an opinion today on the use of this biometric surveillance in public — to set out what is dubbed as the “rule…', 'url': 'http://techcrunch.com/2021/06/18/uks-ico-warns-over-big-data-surveillance-threat-of-live-facial-recognition-in-public/', 'urlToImage': 'https://techcrunch.com/wp-content/uploads/2019/03/GettyImages-51478187.jpg?w=764', 'publishedAt': '2021-06-18T09:26:45Z', 'content': 'The UK’s chief data protection regulator has warned over reckless and inappropriate use of live facial recognition (LFR) in public places.\r\nPublishing an opinion today on the use of this biometric su… [+10257 chars]'}"
7,ok,926,"{'source': {'id': 'techcrunch', 'name': 'TechCrunch'}, 'author': 'Natasha Lomas', 'title': 'UK gets data flows deal from EU — for now', 'description': 'The UK’s digital businesses can breathe a sign of relief today as the European Commission has officially signed off on data adequacy for the (now) third country, post-Brexit. It’s a big deal for UK businesses as it means the country will be treated by Brussel…', 'url': 'http://techcrunch.com/2021/06/28/uk-gets-data-flows-deal-from-eu-for-now/', 'urlToImage': 'https://techcrunch.com/wp-content/uploads/2019/11/GettyImages-1146371917.jpg?w=600', 'publishedAt': '2021-06-28T12:52:23Z', 'content': 'The UK’s digital businesses can breathe a sign of relief today as the European Commission has officially signed off on data adequacy for the (now) third country, post-Brexit.\r\nIt’s a big deal for UK … [+9859 chars]'}"
8,ok,926,"{'source': {'id': 'business-insider', 'name': 'Business Insider'}, 'author': 'insider@insider.com (Katie Canales)', 'title': ""The rise of Lina Khan, a Big Tech critic who just assumed the helm of the country's most powerful antitrust enforcement agency"", 'description': ""Lina Khan studied law at Yale and wrote a critical paper on Amazon in 2017. Now, she's leading the US agency empowered to break Big Tech apart."", 'url': 'https://www.businessinsider.com/ftc-chair-lina-khan-antitrust-critic-big-tech-amazon-2021-6', 'urlToImage': 'https://i.insider.com/60d0dd943093db00197024d4?width=1200&format=jpeg', 'publishedAt': '2021-06-21T21:41:52Z', 'content': ""Lina Khan has been one of Big Tech's biggest critics and she just took the reins of the government agency empowered to enforce antitrust laws against them.\xa0\r\nAt 32-years-old, Khan is the youngest per… [+3851 chars]""}"
9,ok,926,"{'source': {'id': 'techcrunch', 'name': 'TechCrunch'}, 'author': 'Mike Butcher', 'title': 'Exclusive: Hepsiburada CEO sets out her vision, as it becomes first ever Turkish Nasdaq IPO', 'description': 'Hepsiburada — Turkey’s giant online shopping platform considered the Amazon of its country —\xa0floats on the Nasdaq today,\xa0for a\xa0valuation likely to exceed $3.9 billion on current projections, especially with shares being marked up to $14 apiece (up from the pr…', 'url': 'http://techcrunch.com/2021/07/01/exclusive-hepsiburada-ceo-sets-out-her-vision-as-it-becomes-first-ever-turkish-nasdaq-ipo/', 'urlToImage': 'https://techcrunch.com/wp-content/uploads/2021/07/Hanzade-Doğan-Boyner.jpg?w=600', 'publishedAt': '2021-07-01T16:28:31Z', 'content': 'Hepsiburada Turkey’s giant online shopping platform considered the Amazon of its country \xa0floats on the Nasdaq today,\xa0for a\xa0valuation likely to exceed $3.9 billion on current projections, especially … [+7476 chars]'}"
10,ok,926,"{'source': {'id': 'reuters', 'name': 'Reuters'}, 'author': 'Reuters Staff', 'title': ""UK watchdog looking into Apple, Google's dominance of mobile phone systems - Reuters"", 'description': ""Britain's competition watchdog said it would investigate whether Apple and Google's dominance of mobile phone operating systems, app stores and web browsers hurt consumers, launching its latest probe into the tech giants."", 'url': 'https://www.reuters.com/article/uk-britain-regulator-apple-google-idUSKCN2DR11Y', 'urlToImage': 'https://static.reuters.com/resources/r/?m=02&d=20210615&t=2&i=1565749177&r=LYNXNPEH5E0I2&w=800', 'publishedAt': '2021-06-15T11:45:00Z', 'content': 'By Reuters Staff\r\nFILE PHOTO: A 3D printed Google logo is placed on the Apple Macbook in this illustration taken April 12, 2020. REUTERS/Dado Ruvic/Illustration\r\nLONDON (Reuters) -Britains competitio… [+1631 chars]'}"
11,ok,926,"{'source': {'id': None, 'name': 'Slashdot.org'}, 'author': 'msmash', 'title': ""Apple-Google Mobile 'Duopoly' Faces UK Antitrust Scrutiny"", 'description': 'Google and Apple face a sweeping probe into the ""duopoly"" power of their mobile ecosystems, in the U.K. antitrust watchdog\'s latest attack on Silicon Valley. From a report: The increasingly tech-focused Competition and Markets Authority opened a 12-month mark…', 'url': 'https://news.slashdot.org/story/21/06/15/1555206/apple-google-mobile-duopoly-faces-uk-antitrust-scrutiny', 'urlToImage': 'https://a.fsdn.com/sd/topics/uk_64.png', 'publishedAt': '2021-06-15T16:05:00Z', 'content': 'If the purpose is to investigate if Google or Apple did anything illegal, yes investigate. If the goal is to force more competitors into a market that was created by market forces then no.\r\nFrom my p… [+259 chars]'}"
12,ok,926,"{'source': {'id': 'techcrunch', 'name': 'TechCrunch'}, 'author': 'Natasha Lomas', 'title': 'UK’s CMA opens market study into Apple, Google’s mobile “duopoly”', 'description': 'The UK’s competition watchdog will take a deep dive look into Apple and Google’s dominance of the mobile ecosystem, it said today — announcing a market study which will examine the pair’s respective smartphone platforms (iOS and Android); their app stores (Ap…', 'url': 'http://techcrunch.com/2021/06/15/uks-cma-opens-market-study-into-apple-googles-mobile-duopoly/', 'urlToImage': 'https://techcrunch.com/wp-content/uploads/2015/05/shutterstock_167852012.jpg?w=586', 'publishedAt': '2021-06-15T14:45:41Z', 'content': 'The UK’s competition watchdog will take a deep dive look into Apple and Google’s dominance of the mobile ecosystem, it said today — announcing a market study which will examine the pair’s respective … [+6565 chars]'}"
13,ok,926,"{'source': {'id': 'techcrunch', 'name': 'TechCrunch'}, 'author': 'Devin Coldewey', 'title': 'ISEE brings autonomy to shipping yards with self-driving container trucks', 'description': 'Robotaxis may still be a few years out, but there are other industries that can be transformed by autonomous vehicles as they are today. MIT spin-off ISEE has identified one in the common shipping yard, where containers are sorted and stored — today by a dwin…', 'url': 'http://techcrunch.com/2021/06/08/isee-brings-autonomy-to-shipping-yards-with-self-driving-container-trucks/', 'urlToImage': 'https://techcrunch.com/wp-content/uploads/2021/06/ISEE-Yard-Truck-Group.jpg?w=707', 'publishedAt': '2021-06-08T16:04:04Z', 'content': 'Robotaxis may still be a few years out, but there are other industries that can be transformed by autonomous vehicles as they are today. MIT spin-off ISEE has identified one in the common shipping ya… [+5708 chars]'}"
14,ok,926,"{'source': {'id': None, 'name': 'Slashdot.org'}, 'author': 'msmash', 'title': 'Senate Confirms Progressive Tech Critic Lina Khan To Become an FTC Commissioner', 'description': ""The Senate confirmed President Joe Biden's nominee to the Federal Trade Commission, Lina Khan, the young progressive who helped launch a reckoning amongst antitrust scholars and enforcers, in a 69-28 vote. From a report: At 32, Khan will become the youngest c…"", 'url': 'https://news.slashdot.org/story/21/06/15/1851217/senate-confirms-progressive-tech-critic-lina-khan-to-become-an-ftc-commissioner', 'urlToImage': 'https://a.fsdn.com/sd/topics/usa_64.png', 'publishedAt': '2021-06-15T19:00:00Z', 'content': 'At 32, Khan will become the youngest commissioner ever confirmed to the agency. Her confirmation also signals a bipartisan desire to impose more regulations on Big Tech companies like Facebook, Amazo… [+1355 chars]'}"
15,ok,926,"{'source': {'id': 'techcrunch', 'name': 'TechCrunch'}, 'author': 'Natasha Lomas', 'title': 'EU is now investigating Google’s adtech over antitrust concerns', 'description': 'EU antitrust authorities are finally taking a broad and deep look into Google’s adtech stack and role in the online ad market — confirming today that they’ve opened a formal investigation. Google has already been subject to three major EU antitrust enforcemen…', 'url': 'http://techcrunch.com/2021/06/22/eu-is-now-investigating-googles-adtech-over-antitrust-concerns/', 'urlToImage': 'https://techcrunch.com/wp-content/uploads/2015/10/shutterstock_323833889.jpg?w=711', 'publishedAt': '2021-06-22T11:47:06Z', 'content': 'EU antitrust authorities are finally taking a broad and deep look into Google’s adtech stack and role in the online ad market — confirming today that they’ve opened a formal investigation.\r\nGoogle ha… [+9080 chars]'}"
16,ok,926,"{'source': {'id': 'business-insider', 'name': 'Business Insider'}, 'author': 'ewu@insider.com (Ethan Wu)', 'title': 'Tech stocks look cheap and could explode in coming decades with their true value still in the early stages of being unlocked, an investment chief says', 'description': 'Parameswaran is also bullish on smaller tech companies directly competing with the likes of Amazon. For smaller players, there are ""riches in niches.""', 'url': 'https://markets.businessinsider.com/news/stocks/tech-stocks-cheap-ram-parameswaran-peloton-google-amazon-alibaba-2021-6-1030533021', 'urlToImage': 'https://images2.markets.businessinsider.com/60cb5bad23393a00188e3ba7?format=jpeg', 'publishedAt': '2021-06-17T15:30:42Z', 'content': 'Francis Scialabba.\r\nFrancis Scialabba\r\nGlobal tech stocks are ""ridiculously cheap"" despite antitrust fears, said Ram Parameswaran, founder and CIO of tech-focused fund Octahedron Capital.\r\nSpeaking o… [+2113 chars]'}"
17,ok,926,"{'source': {'id': None, 'name': '9to5Mac'}, 'author': 'Michael Potuck', 'title': 'Sonos urges regulation of big tech, criticizes Apple’s plans to open Siri to third-parties using HomePod', 'description': 'The latest big tech antitrust hearing is being held by US lawmakers today and Sonos is the main party testifying. Many of the company’s antitrust concerns revolve around Google and Amazon, but Sonos’ chief legal officer also called out its issues with Apple i…', 'url': 'https://9to5mac.com/2021/06/15/sonos-urges-regulation-of-apple-and-big-tech/', 'urlToImage': 'https://i1.wp.com/9to5mac.com/wp-content/uploads/sites/6/2021/06/sonos-apple-antitrust-hearing.jpeg?resize=1200%2C628&quality=82&strip=all&ssl=1', 'publishedAt': '2021-06-15T19:47:33Z', 'content': 'The latest big tech antitrust hearing is being held by US lawmakers today and Sonos is the main party testifying. Many of the company’s antitrust concerns revolve around Google and Amazon, but Sonos’… [+5368 chars]'}"
18,ok,926,"{'source': {'id': 'vice-news', 'name': 'Vice News'}, 'author': 'Greg Walters, Anne Torpey', 'title': 'Ransomware Attacks Could Mean a Big Crackdown on Bitcoin', 'description': 'Recent cyber attacks have prompted calls for regulation that could send a big chill across the crypto world.', 'url': 'https://www.vice.com/en/article/dyvx9j/ransomware-attacks-bitcoin-crackdown', 'urlToImage': 'https://video-images.vice.com/articles/60db4d5e3dea6400931406be/lede/1625066234042-gettyimages-585043481.jpeg?image-resize-opts=Y3JvcD0xeHc6MC44Njg2OTI2NjA1NTA0NTg3eGg7Y2VudGVyLGNlbnRlciZyZXNpemU9MTIwMDoqJnJlc2l6ZT0xMjAwOio', 'publishedAt': '2021-06-30T15:18:58Z', 'content': 'Want the best of VICE News straight to your inbox? Sign up here.\r\nCyber crooks keep holding huge American companies hostage for hundreds of millions in cryptocurrency. And attempts to stop them could… [+2738 chars]'}"
19,ok,926,"{'source': {'id': 'techcrunch', 'name': 'TechCrunch'}, 'author': 'Natasha Lomas', 'title': 'Europe wants to go its own way on digital identity', 'description': 'In its latest ambitious digital policy announcement, the European Union has proposed creating a framework for a “trusted and secure European e-ID” (aka digital identity) — which it said today it wants to be available to all citizens, residents and businesses …', 'url': 'http://techcrunch.com/2021/06/03/europe-wants-to-go-its-own-way-on-digital-identity/', 'urlToImage': 'https://techcrunch.com/wp-content/uploads/2019/06/GettyImages-1013951900-1.jpg?w=600', 'publishedAt': '2021-06-04T00:32:07Z', 'content': 'In its latest ambitious digital policy announcement, the European Union has proposed creating a framework for a “trusted and secure European e-ID” (aka digital identity) — which it said today it want… [+9154 chars]'}"
20,ok,926,"{'source': {'id': 'wired', 'name': 'Wired'}, 'author': 'Luke Winkie', 'title': 'Indie Video Games Have Finally Embraced the Tabletop Scene', 'description': ""Video games like 'Monster Train,' 'Slay the Spire,' and 'Gordian Quest' use decks, cards, and dice rolls to stake their claim."", 'url': 'https://www.wired.com/story/indie-developers-studios-tabletop-board-games/', 'urlToImage': 'https://media.wired.com/photos/60b13f07c4c56a005b696875/191:100/w_1280,c_limit/games_tabletop.jpg', 'publishedAt': '2021-06-01T11:00:00Z', 'content': ""Monster Train isn't alone. We are living through a renaissance of video games that take direct influence from tabletop ideas.\r\nTake 2017s Slay the Spire, one of the most popular games on the internet… [+5186 chars]""}"
21,ok,926,"{'source': {'id': 'reuters', 'name': 'Reuters'}, 'author': 'Reuters', 'title': 'Two Republican U.S. senators introduce antitrust bill - Reuters', 'description': ""Republican Senators Mike Lee and Chuck Grassley introduced a bill on Tuesday that would move all antitrust enforcement to the Justice Department, stripping the Federal Trade Commission and Federal Communications Commission of antitrust authority, Lee's office…"", 'url': 'https://www.reuters.com/business/two-republican-us-senators-introduce-antitrust-bill-2021-06-14/', 'urlToImage': 'https://www.reuters.com/resizer/WRnySpqLUaHAmWvURvWCS0rBPaQ=/800x419/smart/filters:quality(80)/cloudfront-us-east-2.images.arcpublishing.com/reuters/32ENDFB6INK5BGGBFRBERL7POE.jpg', 'publishedAt': '2021-06-14T23:19:00Z', 'content': 'Republican Senators Mike Lee and Chuck Grassley introduced a bill on Tuesday that would move all antitrust enforcement to the Justice Department, stripping the Federal Trade Commission and Federal Co… [+1774 chars]'}"
22,ok,926,"{'source': {'id': None, 'name': 'Android Central'}, 'author': 'Jeramy Johnson', 'title': 'This collective wants you to rent your phone to save the planet', 'description': ""A small group of European companies is trying to make the process of using mobile technology fairer and more sustainable.\n\n\n\nReading about the topic of sustainability in tech is often as interesting as the idea of recycling itself; nominally, you know it's go…"", 'url': 'https://www.androidcentral.com/new-fairtec-collaboration-wants-rehabilitate-unsustainable-mobile-industry', 'urlToImage': 'https://www.androidcentral.com/sites/androidcentral.com/files/styles/large/public/article_images/2020/03/fairphone-3-modular-lifestyle.jpg', 'publishedAt': '2021-06-25T12:30:02Z', 'content': ""Source: Fairphone\r\nReading about the topic of sustainability in tech is often as interesting as the idea of recycling itself; nominally, you know it's good for you (and the earth), but you often just… [+13769 chars]""}"
23,ok,926,"{'source': {'id': None, 'name': 'NPR'}, 'author': 'Bobby Allyn', 'title': 'States Fight Over How Our Data Is Tracked And Sold Online, As Congress Stalls', 'description': 'New laws in California and Virginia represent vastly different approaches to how personal data is collected online and sold.  Many other states are considering their own legislation.', 'url': 'https://www.npr.org/2021/06/04/1003205422/states-fight-over-how-our-data-is-tracked-and-sold-online-as-congress-stalls', 'urlToImage': 'https://media.npr.org/assets/img/2021/06/04/ap20276767811986_wide-be78f7f5f81ae780b21042f35db8db6495d7aa27.jpg?s=1400', 'publishedAt': '2021-06-04T23:34:08Z', 'content': 'California and Virginia are the only two states that have passed data privacy laws. Now more than 20 proposals in states nationwide are being debated, just as Congress dithers on the issue of data tr… [+5905 chars]'}"
24,ok,926,"{'source': {'id': None, 'name': 'Euronews'}, 'author': None, 'title': 'Exclusive: WHO estimates COVID-19 boosters needed yearly for most vulnerable - Euronews', 'description': ""<ol><li>Exclusive: WHO estimates COVID-19 boosters needed yearly for most vulnerable\xa0\xa0Euronews\r\n</li><li>Nearly all COVID-19 deaths in U.S. are now among people who aren't vaccinated\xa0\xa0CBC.ca\r\n</li><li>Your weird vaccine 'side effects' are likely harmless\xa0\xa0Ott…"", 'url': 'https://www.euronews.com/2021/06/24/us-health-coronavirus-who-exclusive', 'urlToImage': 'https://static.euronews.com/articles/wires/731/02/7310260/1000x563_xe25oo.jpg', 'publishedAt': '2021-06-24T15:13:54Z', 'content': 'By Francesco Guarascio\r\nBRUSSELS – The World Health Organization (WHO) forecasts that people most vulnerable to COVID-19, such as the elderly, will need to get an annual vaccine booster to be protect… [+3450 chars]'}"
25,ok,926,"{'source': {'id': 'techcrunch', 'name': 'TechCrunch'}, 'author': 'Ingrid Lunden', 'title': 'Shogun, a front end e-commerce page builder, nabs $67.5M as retailers look for alternatives to marketplaces', 'description': 'E-commerce marketplaces continue to play a major role in how consumers buy goods online and how retailers show off and sell goods to those consumers, accounting globally for 47% of all e-commerce sales. But today, one of the startups that has built technology…', 'url': 'http://techcrunch.com/2021/06/30/shogun-a-front-end-e-commerce-page-builder-nabs-67-5m-as-retailers-look-for-alternatives-to-marketplaces/', 'urlToImage': 'https://techcrunch.com/wp-content/uploads/2020/02/Frontend-UI-1.jpg?w=563', 'publishedAt': '2021-06-30T11:00:36Z', 'content': 'E-commerce marketplaces continue to play a major role in how consumers buy goods online and how retailers show off and sell goods to those consumers, accounting globally for 47% of all e-commerce sal… [+5994 chars]'}"
26,ok,926,"{'source': {'id': None, 'name': 'The Guardian'}, 'author': 'Alex Hern', 'title': 'OpenStreetMap looks to relocate to EU due to Brexit limitations', 'description': 'Open-source UK tech company cites copyright issues, rising costs and prospect of more influence in EUOpenStreetMap, the Wikipedia-for-maps organisation that seeks to create a free and open-source map of the globe, is considering relocating to the EU, almost 2…', 'url': 'https://amp.theguardian.com/politics/2021/jun/30/openstreetmap-looks-to-relocate-to-eu-due-to-brexit-limitations', 'urlToImage': 'https://i.guim.co.uk/img/media/bf1e22758bff10e567ed60513c186906ca4b9395/349_71_1296_777/master/1296.jpg?width=1200&height=630&quality=85&auto=format&fit=crop&overlay-align=bottom%2Cleft&overlay-width=100p&overlay-base64=L2ltZy9zdGF0aWMvb3ZlcmxheXMvdGctZGVmYXVsdC5wbmc&enable=upscale&s=28a517efa490ed5de167b9983d555b1d', 'publishedAt': '2021-06-30T06:00:31Z', 'content': 'OpenStreetMap, the Wikipedia-for-maps organisation that seeks to create a free and open-source map of the globe, is considering relocating to the EU, almost 20 years after it was founded in the UK by… [+2946 chars]'}"
