,status,totalResults,articles
84,ok,926,"{'source': {'id': None, 'name': 'OnMSFT'}, 'author': 'Kareem Anderson', 'title': ""Microsoft gears up for future tech regulations with expanded 'legal affairs unit'"", 'description': ""According to a report from Axios, Microsoft president Brad Smith explained the company's plan to expand its legal and corporate affairs unit by as much as 20 percent ahead of potential regulation battles. While Microsoft usually goes through an annual ... Rea…"", 'url': 'https://www.onmsft.com/news/microsoft-gears-up-for-future-tech-regulations', 'urlToImage': 'https://www.onmsft.com/wp-content/uploads/2021/06/Microsoft-Brad-Smith-FTC-Antitrust.jpg', 'publishedAt': '2021-06-30T03:32:14Z', 'content': ""According to a report from Axios, Microsoft president Brad Smith explained the company's plan to expand its legal and corporate affairs unit by as much as 20 percent ahead of potential regulation bat… [+2008 chars]""}"
85,ok,926,"{'source': {'id': None, 'name': 'MarketWatch'}, 'author': 'Thornton McEnery', 'title': 'IPO Report: The 5 most eye-popping disclosures in Robinhood’s long-awaited IPO filing', 'description': 'From lawsuits to rapid growth to dogecoin, the most anticipated IPO filing in months did not disappoint', 'url': 'https://www.marketwatch.com/story/the-5-most-eye-popping-disclosures-in-robinhoods-long-awaited-ipo-filing-11625178338', 'urlToImage': 'https://images.mktw.net/im-289832/social', 'publishedAt': '2021-07-01T22:28:00Z', 'content': 'Wall Street is finally getting a peek under the hood of Robinhood ahead of the most anticipated public debut since WeWork, and while the no-fee trading apps offering prospectus is not as much of a sh… [+7465 chars]'}"
86,ok,926,"{'source': {'id': None, 'name': 'Forbes'}, 'author': 'Daniel Heer, Forbes Councils Member, \n Daniel Heer, Forbes Councils Member\n https://www.forbes.com/sites/forbestechcouncil/people/danielheer/', 'title': 'Winners, Losers And What’s Next In Data Protection Regulation', 'description': 'With restrictions around data privacy set to reach an even higher level soon with the deprecation of third-party cookies, now’s the time to reflect on the last time our approach to customer data underwent such a radical change — and what we can learn for next…', 'url': 'https://www.forbes.com/sites/forbestechcouncil/2021/06/11/winners-losers-and-whats-next-in-data-protection-regulation/', 'urlToImage': 'https://thumbor.forbes.com/thumbor/fit-in/1200x0/filters%3Aformat%28jpg%29/https%3A%2F%2Fspecials-images.forbesimg.com%2Fimageserve%2F820808708%2F0x0.jpg', 'publishedAt': '2021-06-11T13:20:00Z', 'content': ""Founder &amp; CEO of\xa0Zeotap, a customer intelligence platform that helps brands better understand their customers and predict behaviors.\r\nGetty\r\nIt's now been three years since the EUs General Data P… [+5960 chars]""}"
87,ok,926,"{'source': {'id': None, 'name': 'Adweek'}, 'author': 'David Cohen, Lucinda Southern', 'title': 'Facebook’s Antitrust Dismissal Shows the Slow Grind of Big Tech Regulation', 'description': 'Facebook took home a small win on Monday, but the social networking giant is far from out of the woods yet, especially internationally, as growing regulatory pressure continues to circle Big Tech. U.S. District Court Judge James Boasberg dismissed separate an…', 'url': 'https://www.adweek.com/media/facebooks-antitrust-dismissal-shows-the-slow-grind-of-big-tech-regulation/', 'urlToImage': 'https://www.adweek.com/wp-content/uploads/2021/06/antitrust-suits-fb-dismissed-2021-600x315.jpg', 'publishedAt': '2021-06-29T19:17:07Z', 'content': 'Facebook took home a small win on Monday, but the social networking giant is far from out of the woods yet, especially internationally, as growing regulatory pressure continues to circle Big Tech.'}"
88,ok,926,"{'source': {'id': 'business-insider', 'name': 'Business Insider'}, 'author': 'Martin Coulter', 'title': 'The UK is scrutinizing Apple and Google over whether their mobile dominance hurts users and other businesses', 'description': ""Summary List PlacementApple and Google are under scrutiny in the UK over whether their combined dominance of the mobile ecosystem could be harming both users and businesses.\nGoogle's Android operation system is used by 59% of smartphone users in the UK, the e…"", 'url': 'https://www.businessinsider.com/apple-google-uk-competition-scrutiny-mobile-dominance-2021-6', 'urlToImage': 'https://i.insider.com/5c73fc4deb3ce849647e77a2?width=1200&format=jpeg', 'publishedAt': '2021-06-15T14:26:47Z', 'content': ""Apple and Google are under scrutiny in the UK over whether their combined dominance of the mobile ecosystem could be harming both users and businesses.\r\nGoogle's Android operation system is used by 5… [+2122 chars]""}"
89,ok,926,"{'source': {'id': None, 'name': 'Greenwich Time'}, 'author': 'The Associated Press', 'title': 'Business Highlights: Big Tech legislation, mortgage overseer - Greenwich Time', 'description': 'Business Highlights: Big Tech legislation, mortgage overseer\xa0\xa0Greenwich Time', 'url': 'https://www.greenwichtime.com/business/article/Business-Highlights-Big-Tech-legislation-16269484.php', 'urlToImage': 'https://www.greenwichtime.com/img/pages/article/opengraph_default.jpg', 'publishedAt': '2021-06-23T21:39:26Z', 'content': 'WASHINGTON (AP) — A House panel is pushing ahead with ambitious legislation that could curb the market power of tech giants Facebook, Google, Amazon and Apple and force them to sever their dominant p… [+6321 chars]'}"
90,ok,926,"{'source': {'id': None, 'name': 'Techdirt'}, 'author': 'Tim Cushing', 'title': ""Florida Steps Up To Defend Its Unconstitutional Social Media Law And It's Every Bit As Terrible As You'd Imagine"", 'description': 'About a month ago, the governor of Florida signed a showboating bill into law -- one that made it illegal to deplatform people running for office. Well, mostly. It exempted ""theme park-associated"" websites from the bill to appease the state\'s Disney overlords…', 'url': 'https://www.techdirt.com/articles/20210624/19141147055/florida-steps-up-to-defend-unconstitutional-social-media-law-every-bit-as-terrible-as-youd-imagine.shtml', 'urlToImage': 'https://ii.techdirt.com/s/t/i/td_icon_300.png', 'publishedAt': '2021-06-28T12:39:48Z', 'content': 'from the discredited-nonsense-cited dept\r\nAbout a month ago, the governor of Florida signed a showboating bill into law -- one that made it illegal to deplatform people running for office. Well, most… [+9818 chars]'}"
91,ok,926,"{'source': {'id': 'business-insider', 'name': 'Business Insider'}, 'author': 'Martin Coulter', 'title': ""Insiders think Google's unprecedented deal with UK government has given Boris Johnson the chance to lead the tech policy agenda at the G7 summit"", 'description': ""Summary List PlacementThe UK government is attempting to lead the global conversation on technology regulation as it plays host to a crowd of partner nations at the G7 this week, experts say.\xa0\nRegulating the tech industry has been a major theme at this year's…"", 'url': 'https://www.businessinsider.com/g7-summit-uk-technology-google-2021-6', 'urlToImage': 'https://i.insider.com/60c3609823393a00188e29d5?width=1200&format=jpeg', 'publishedAt': '2021-06-13T09:01:00Z', 'content': 'The UK government is attempting to lead the global conversation on technology regulation as it plays host to a crowd of partner nations at the G7 this week, experts say.\xa0\r\nRegulating the tech industr… [+3414 chars]'}"
92,ok,926,"{'source': {'id': None, 'name': 'pymnts.com'}, 'author': 'PYMNTS', 'title': 'Didi IPO And China’s Big Tech Warning Signs - pymnts.com', 'description': 'Wall Street enthusiasm for Didi Global’s IPO stands in stark contrast to actions in China that are bringing Big Tech increasingly under the microscope.', 'url': 'https://www.pymnts.com/news/ipo/2021/didi-ipo-and-chinas-big-tech-warning-signs/', 'urlToImage': 'https://securecdn.pymnts.com/wp-content/uploads/2021/06/Didi-IPO-China-Big-Tech-1000x600.jpg', 'publishedAt': '2021-06-29T14:50:52Z', 'content': 'In China, the approach to Big Tech firms leans, increasingly, toward regulation.\r\nAnd that might make investing in Chinas marquee names, especially on other shores, a bit fraught.\r\nAfter all, Wall St… [+3333 chars]'}"
93,ok,926,"{'source': {'id': None, 'name': 'Motley Fool'}, 'author': 'newsfeedback@fool.com (Billy Duberstein)', 'title': 'Is Tencent Stock a Buy?', 'description': 'As investors have flocked to SPACs, cryptocurrencies, and meme stocks, high-quality tech stocks like Tencent have become bargains.', 'url': 'https://www.fool.com/investing/2021/06/10/is-tencent-stock-a-buy/', 'urlToImage': 'https://g.foolcdn.com/editorial/images/630233/two-men-business-suit-tablet.jpg', 'publishedAt': '2021-06-10T12:30:00Z', 'content': ""With investors chasing the latest meme stock, cryptocurrency, or new IPO or SPAC, large-cap tech stocks like Tencent(OTC:TCEHY) may seem like yesterday's news. In fact, you may not have noticed, but … [+4955 chars]""}"
94,ok,926,"{'source': {'id': None, 'name': 'TidBITS'}, 'author': 'Adam Engst', 'title': 'Ben Thompson Examines US Big Tech Legislation', 'description': 'Confused by what’s involved with the recent bills proposed by lawmakers in the US House of Representatives aimed at curbing the power of Big Tech? Ben Thompson of Stratechery breaks down each bill and evaluates the impact on different companies, including App…', 'url': 'https://tidbits.com/2021/06/18/ben-thompson-examines-us-big-tech-legislation/', 'urlToImage': None, 'publishedAt': '2021-06-18T19:09:44Z', 'content': 'As you may have read, lawmakers in the US House of Representatives have proposed a set of bills designed to rein in the power of Big Tech: specifically Amazon, Apple, Facebook, and Google, though Mic… [+764 chars]'}"
95,ok,926,"{'source': {'id': None, 'name': 'NPR'}, 'author': 'NPR', 'title': ""'Be Anti-Racist' Podcast; New FTC Chair Opposes Big Tech : Here & Now - NPR"", 'description': 'We speak with author and professor Ibram X. Kendi about his podcast ""Be Anti-Racist with Ibram X. Kendi"" which builds on his best-selling book. And, Biden\'s new Federal Trade Commissioner Lina Khan made a name for herself by advocating for stricter regulation…', 'url': 'https://www.npr.org/2021/07/01/1012235702/be-anti-racist-podcast-new-ftc-chair-opposes-big-tech', 'urlToImage': 'https://media.npr.org/include/images/facebook-default-wide.jpg?s=1400', 'publishedAt': '2021-07-01T20:02:36Z', 'content': 'We speak with author and professor Ibram X. Kendi about his podcast ""Be Anti-Racist with Ibram X. Kendi"" which builds on his best-selling book. And, Biden\'s new Federal Trade Commissioner Lina Khan m… [+369 chars]'}"
96,ok,926,"{'source': {'id': None, 'name': 'Minnesota Public Radio News'}, 'author': None, 'title': ""Libertarian economist Bryan Caplan on 'Freedom, Populism and Big Tech' - Minnesota Public Radio News"", 'description': 'George Mason University economics professor Bryan Caplan speaks at St. Olaf College about “Freedom, Populism and Big Tech.”', 'url': 'https://www.mprnews.org/story/2021/06/03/bryan-caplan-on-populism-big-tech', 'urlToImage': 'https://img.apmcdn.org/5ed3e5fa760b7f0fd4841fb84ba1387067c60a61/widescreen/132a94-20210601-bryancaplan-1462.jpg', 'publishedAt': '2021-06-02T23:48:39Z', 'content': 'St. Olaf College hosted a series of speakers this spring focused on the broad theme of ""America After Trump."" Bryan Caplan is a libertarian economist at George Mason University, and he was asked to s… [+1270 chars]'}"
97,ok,926,"{'source': {'id': None, 'name': 'Stratechery.com'}, 'author': 'Ben Thompson', 'title': 'The Cicilline Salvo', 'description': 'A package of new proposed laws for regulating tech companies are in part a negotiating ploy, but also an indicator of change.', 'url': 'https://stratechery.com/2021/the-cicilline-salvo/', 'urlToImage': 'https://i0.wp.com/stratechery.com/wp-content/uploads/2018/03/cropped-android-chrome-512x512-1.png?fit=512%2C512&ssl=1', 'publishedAt': '2021-06-15T11:54:20Z', 'content': 'From the Wall Street Journal:\r\nHouse lawmakers proposed a raft of bipartisan legislation aimed at reining in the countrys biggest tech companies, including a bill that seeks to make Amazon.com Inc. a… [+18207 chars]'}"
98,ok,926,"{'source': {'id': None, 'name': 'The Dallas Morning News'}, 'author': 'Alexander William Salter', 'title': 'Politicians hate Big Tech, but they haven’t explained why big is bad - The Dallas Morning News', 'description': 'The American political class is increasingly skeptical of Big Tech. Both right and left are displeased with Alphabet (the parent company of Google), Amazon...', 'url': 'https://www.dallasnews.com/opinion/commentary/2021/06/28/politicians-hate-big-tech-but-they-havent-explained-why-big-is-bad/', 'urlToImage': 'https://dmn-dallas-news-prod.cdn.arcpublishing.com/resizer/itEC2g2KiKZMqIdC8z6lJG9ymQ0=/1200x630/smart/filters:no_upscale()/cloudfront-us-east-1.images.arcpublishing.com/dmn/R6O7IRC3VXSCMGCK3QPQ4W4RTA.jpg', 'publishedAt': '2021-06-28T06:34:42Z', 'content': 'The American political class is increasingly skeptical of Big Tech. Both right and left are displeased with Alphabet (the parent company of Google), Amazon and Facebook, to name a few. A House subcom… [+3737 chars]'}"
99,ok,926,"{'source': {'id': None, 'name': 'Broadbandbreakfast.com'}, 'author': 'Jasmine Campos', 'title': 'Institute for Technology and Innovation Foundation Panelists Defend Big Tech Against Antitrust Charges - BroadbandBreakfast.com', 'description': 'During a panel hosted by the Information Technology and Innovation Foundation, three expert discussed the effect of antitrust legislation on big tech. The panelists all defended big tech from antitrust laws and urged many to be cautious about claiming they ha…', 'url': 'https://broadbandbreakfast.com/2021/06/institute-for-technology-and-innovation-foundation-panelists-defend-big-tech-against-antitrust-charges/', 'urlToImage': 'https://i1.wp.com/broadbandbreakfast.com/wp-content/uploads/2021/06/itif-antitrust.jpg?resize=1000%2C577&ssl=1', 'publishedAt': '2021-06-07T14:13:25Z', 'content': 'June 7, 2021 Experts said that the best way to promote innovation and technology advancements, including advancements by large tech companies, is to spur on and allow greater competition between comp… [+1834 chars]'}"
