,status,totalResults,articles
55,ok,926,"{'source': {'id': 'politico', 'name': 'Politico'}, 'author': 'Alexandra S. Levine', 'title': 'Why Washington’s big plan to protect Americans’ data is languishing', 'description': 'The Biden era heightened momentum for the U.S. to pass a national privacy law, but those efforts have stalled, threatening prospects for broader action to rein in Silicon Valley.', 'url': 'https://www.politico.com/news/2021/06/01/washington-plan-protect-american-data-silicon-valley-491405', 'urlToImage': 'https://static.politico.com/88/89/eedb59f54b1e9c94e9e628094f46/210528-google-getty-773.jpg', 'publishedAt': '2021-06-01T08:31:26Z', 'content': ""And that doesnt bode well for Washingtons broader push totake on the tech industry's titans. The deadlock on privacy sets a precedent for how much or little this Congress can move on other more polit… [+8668 chars]""}"
56,ok,926,"{'source': {'id': 'axios', 'name': 'Axios'}, 'author': 'Ashley Gold, Hope King', 'title': 'Global Big Tech regulation is here - Axios', 'description': 'What tech fears more than regulation is inconsistency.', 'url': 'https://www.axios.com/global-big-tech-regulation-is-here-f877d5d4-f07c-4fa2-a405-f14fd3fdfe56.html', 'urlToImage': 'https://images.axios.com/n1o1j1VQXrrKbiCKaNlUTSStC_E=/0x0:1920x1080/1366x768/2021/06/21/1624292385639.jpg', 'publishedAt': '2021-06-21T19:30:35Z', 'content': 'The European Union has been trying to regulate Big\xa0Tech\xa0from the other side of the Atlantic, but now its countries are teaming up with the U.S. to figure out an even bigger framework of regulation.\r\n… [+1366 chars]'}"
57,ok,926,"{'source': {'id': 'techcrunch', 'name': 'TechCrunch'}, 'author': 'Romain Dillet', 'title': 'Macron says G7 countries should work together to tackle toxic online content', 'description': 'In a press conference at the Élysée Palace, French President Emmanuel Macron reiterated his focus on online regulation, and more particularly toxic content...', 'url': 'https://techcrunch.com/2021/06/10/macron-says-g7-countries-should-work-together-to-tackle-toxic-online-content/', 'urlToImage': 'https://s.yimg.com/ny/api/res/1.2/ZYqnKIDYPQphDEd8FrMkuw--/YXBwaWQ9aGlnaGxhbmRlcjt3PTIwMDA7aD0xMzM0/https://s.yimg.com/uu/api/res/1.2/AQ_5LTZUsYM6Y7eGdlo1Nw--~B/aD0zNTAwO3c9NTI0ODthcHBpZD15dGFjaHlvbg--/https://media.zenfs.com/en/techcrunch_350/0a986cfe4cae10737e023555f1107c71', 'publishedAt': '2021-06-10T18:27:38Z', 'content': 'In a press conference at the Élysée Palace, French President Emmanuel Macron reiterated his focus on online regulation, and more particularly toxic content. He called for more international cooperati… [+3952 chars]'}"
58,ok,926,"{'source': {'id': 'time', 'name': 'Time'}, 'author': 'Charlie Campbell / Chengdu and Shanghai', 'title': 'Why China Is Cracking Down on Bitcoin Mining and What It Could Mean for Other Countries', 'description': 'The annual spring rains bring many changes to southwestern China’s Sichuan province. Downpours transform the mottled landscape into lush emerald, while azaleas bloom and migrating cranes and storks begin the long journey back north. The rainfall also brings t…', 'url': 'https://time.com/6051991/why-china-is-cracking-down-on-bitcoin-mining-and-what-it-could-mean-for-other-countries/', 'urlToImage': 'https://api.time.com/wp-content/uploads/2021/06/bitcoin-mining-china.jpg?quality=85&w=1200&h=628&crop=1', 'publishedAt': '2021-06-02T10:30:56Z', 'content': 'The annual spring rains bring many changes to southwestern China’s Sichuan province. Downpours transform the mottled landscape into lush emerald, while azaleas bloom and migrating cranes and storks b… [+12470 chars]'}"
59,ok,926,"{'source': {'id': None, 'name': 'Lever.co'}, 'author': None, 'title': 'Make School (YC W12) is hiring a President to lead our non-profit college', 'description': ""Make School is a next-generation non-profit college focused on bridging the equity gap among underrepresented populations in technology. Our Bachelor's degree in Applied Computer Science - offered in-person and online - blends liberal arts and computer scienc…"", 'url': 'https://jobs.lever.co/makeschool/da97fc54-4d3b-457f-8c64-c06c27f43726', 'urlToImage': 'https://lever-client-logos.s3.amazonaws.com/cada1d45-744c-4b19-8372-e9e15326fb28-1552002321721.png', 'publishedAt': '2021-06-03T17:00:25Z', 'content': ""Make School is a next-generation non-profit college focused on bridging the equity gap among underrepresented populations in technology.\xa0Our Bachelor's degree in Applied Computer Science - offered in… [+3131 chars]""}"
60,ok,926,"{'source': {'id': None, 'name': 'Motley Fool'}, 'author': 'newsfeedback@fool.com (Chris Neiger)', 'title': 'Why Roku Stock Popped Today', 'description': 'Some investors are happy to see the introduction of potential tech company regulations.', 'url': 'https://www.fool.com/investing/2021/06/14/why-roku-stock-popped-today/', 'urlToImage': 'https://g.foolcdn.com/editorial/images/630713/gettyimages-694478620.jpg', 'publishedAt': '2021-06-14T18:48:58Z', 'content': 'What happened\xa0\r\nShares the video streaming platform company Roku\xa0(NASDAQ:ROKU) were climbing today after some lawmakers introduced five bills late last week calling for the potential breakup up of la… [+1806 chars]'}"
61,ok,926,"{'source': {'id': 'bloomberg', 'name': 'Bloomberg'}, 'author': 'Joe Weisenthal, Tracy Alloway', 'title': ""Transcript: Ram Parameswaran Says the World's Biggest Tech Stocks Are Ridiculously Cheap"", 'description': 'In 2020, while the economy was ravaged by the pandemic, several big tech companies did extraordinarily well. Names like Apple, Facebook\xa0and Alphabet proved to be extraordinarily resilient. While other companies like Amazon, Netflix, Zoom\xa0and Peloton got an ex…', 'url': 'https://www.bloomberg.com/news/articles/2021-06-18/transcript-ram-parameswaran-says-the-world-s-biggest-tech-stocks-are-ridiculously-cheap', 'urlToImage': 'https://assets.bwbx.io/images/users/iqjWHBFdfxIU/iYU9kZjJsUUE/v0/1200x800.jpg', 'publishedAt': '2021-06-18T04:48:34Z', 'content': 'In 2020, while the economy was ravaged by the pandemic, several big tech companies did extraordinarily well. Names like Apple, Facebook\xa0and Alphabet proved to be extraordinarily resilient. While othe… [+53337 chars]'}"
62,ok,926,"{'source': {'id': None, 'name': 'Seeking Alpha'}, 'author': 'Baird', 'title': 'Bipartisan Infrastructure; Tax Hike Odds Shrinking; Tech-Lash Picking Up - Market Strategy Weekly - June 18, 2021', 'description': 'Strategas Director of Policy Research Jeannette Lowe breaks down two critical developments: the ongoing debate over trillions in infrastructure spending and movement on big tech regulation.', 'url': 'https://seekingalpha.com/article/4435771-bipartisan-infrastructure-tax-hike-odds-shrinking-tech-lash-market-strategy-weekly-june-18-2021', 'urlToImage': 'http://i.ytimg.com/vi/pE1pK7wjOP0/maxresdefault.jpg', 'publishedAt': '2021-06-21T03:10:00Z', 'content': ""View as PDF\r\nClick to Enlarge\r\n12\r\nOriginal Post\r\n Editor's Note: The summary bullets for this article were chosen by Seeking Alpha editors.""}"
63,ok,926,"{'source': {'id': None, 'name': 'New York Times'}, 'author': '‘Sway’', 'title': 'Is This the Big Tech Breakup We’ve Been Waiting For?', 'description': 'Representative David Cicilline’s bipartisan package takes aim at tech companies and would be the biggest antitrust reform in decades. But is it too little, too fragmented and way too late?', 'url': 'https://www.nytimes.com/2021/06/17/opinion/sway-kara-swisher-david-cicilline.html', 'urlToImage': 'https://static01.nyt.com/images/2021/06/17/opinion/17sway-cicilline-image/17sway-cicilline-image-facebookJumbo.jpg', 'publishedAt': '2021-06-17T09:00:16Z', 'content': 'Representative David Cicilline, Democrat of Rhode Island, is joining forces with Republicans like Ken Buck and Burgess Owens to push through a suite of new antitrust legislation aimed at Amazon, Appl… [+1150 chars]'}"
64,ok,926,"{'source': {'id': None, 'name': 'Techdirt'}, 'author': 'Mike Masnick', 'title': 'Marco Rubio Jumps To The Head Of The Line Of Ignorant Fools Pushing Dumb Social Media Regulation Bills', 'description': ""It seems like we can't have even a peaceful week go by without yet another grandstanding fool in Congress introducing yet another terrible bill to destroy the internet. The latest comes from Senator Marco Rubio, who, last week, excitedly released a ridiculous…"", 'url': 'https://www.techdirt.com/articles/20210625/17322547062/marco-rubio-jumps-to-head-line-ignorant-fools-pushing-dumb-social-media-regulation-bills.shtml', 'urlToImage': 'https://ii.techdirt.com/s/t/i/td_icon_300.png', 'publishedAt': '2021-06-28T17:54:35Z', 'content': ""from the sit-down-marco dept\r\nIt seems like we can't have even a peaceful week go by without yet another grandstanding fool in Congress introducing yet another terrible bill to destroy the internet. … [+6420 chars]""}"
65,ok,926,"{'source': {'id': None, 'name': 'Yahoo Entertainment'}, 'author': 'Ashley Gold', 'title': 'Global Big Tech regulation is here - Yahoo News', 'description': 'The European Union has been trying to regulate Big Tech from the other side of the Atlantic, but now its countries are teaming up with the U.S. to figure out...', 'url': 'https://news.yahoo.com/global-big-tech-regulation-193035466.html', 'urlToImage': 'https://s.yimg.com/uu/api/res/1.2/D0rwAyhLoQmKqC_pp24jdw--~B/aD03MjA7dz0xMjgwO2FwcGlkPXl0YWNoeW9u/https://media.zenfs.com/en/axios_articles_623/cf684656b5d439dd9cd29618fca4095b', 'publishedAt': '2021-06-21T19:30:35Z', 'content': 'The European Union has been trying to regulate Big Tech from the other side of the Atlantic, but now its countries are teaming up with the U.S. to figure out an even bigger framework of regulation.\r\n… [+1552 chars]'}"
66,ok,926,"{'source': {'id': None, 'name': 'Forbes'}, 'author': 'Kelly Anne Smith', 'title': 'How Big Tech Regulation Could Affect You - Forbes', 'description': 'Lawmakers seem to have a simple philosophy these days: Big Tech is too big. A wreath of antitrust lawsuits claim these companies are gobbling up smaller competitors, locking in sellers under unfair terms, creating monopolies and taking away the power of choic…', 'url': 'https://www.forbes.com/advisor/investing/big-tech-regulation/', 'urlToImage': 'https://www.forbes.com/advisor/wp-content/uploads/2021/06/big-tech-antitrust.jpeg', 'publishedAt': '2021-06-22T12:00:31Z', 'content': 'Lawmakers seem to have a simple philosophy these days: Big Tech is too big. A wreath of antitrust lawsuits claim these companies are gobbling up smaller competitors, locking in sellers under unfair t… [+8209 chars]'}"
67,ok,926,"{'source': {'id': None, 'name': 'Fitch Ratings'}, 'author': None, 'title': 'House Bills Put Big Tech One Step Closer to Antitrust Regulation - Fitch Ratings', 'description': 'House Bills Put Big Tech One Step Closer to Antitrust Regulation\xa0\xa0Fitch Ratings', 'url': 'https://www.fitchratings.com/research/corporate-finance/house-bills-put-big-tech-one-step-closer-to-antitrust-regulation-17-06-2021', 'urlToImage': None, 'publishedAt': '2021-06-17T17:30:00Z', 'content': ''}"
68,ok,926,"{'source': {'id': None, 'name': 'Techdirt'}, 'author': 'Cathy Gellis', 'title': ""Congressman Nadler Throws The World's Worst Slumber Party In Order To Destroy The Internet"", 'description': 'House Judiciary Chairman Congressman Nadler really does not like ""big tech"" companies, and four of them (Apple, Google, Facebook, and Amazon) in particular. His antipathy has led him to bypass any further subcommittee inquiry to identify which issues raised b…', 'url': 'https://www.techdirt.com/articles/20210625/09355347057/congressman-nadler-throws-worlds-worst-slumber-party-order-to-destroy-internet.shtml', 'urlToImage': 'https://ii.techdirt.com/s/t/i/td_icon_300.png', 'publishedAt': '2021-06-25T17:43:33Z', 'content': 'from the not-the-last-sleepless-night-this-nonsense-will-cause dept\r\nHouse Judiciary Chairman Congressman Nadler really does not like ""big tech"" companies, and four of them (Apple, Google, Facebook, … [+5599 chars]'}"
69,ok,926,"{'source': {'id': 'politico', 'name': 'Politico'}, 'author': 'Emily Birnbaum', 'title': 'How the House’s Silicon Valley smackdown is dividing conservatives', 'description': ""The effort is drawing opposition from the libertarian Koch network's vast advocacy apparatus but support from many pro-Trump Republicans on the Hill."", 'url': 'https://www.politico.com/news/2021/06/18/koch-silicon-valley-dividing-conservatives-495087', 'urlToImage': 'https://static.politico.com/42/67/7947fc9749c389dcb85d9fae18ca/gettyimages-1317839939.jpg', 'publishedAt': '2021-06-18T08:30:05Z', 'content': 'Getting down to the specifics of these bills, they range from bad to ugly, said Patrick Hedger, vice president of policy for the Taxpayers Protection Alliance, which is funded in part by groups conne… [+8704 chars]'}"
70,ok,926,"{'source': {'id': None, 'name': 'Deadline'}, 'author': 'tedstew1', 'title': 'Ohio Attorney General Seeks To Declare Google A Public Utility In New Lawsuit', 'description': 'The attorney general of Ohio is asking a state court to declare Google a public utility, something that would subject the search giant to extensive government regulation. The lawsuit (read it here) was filed by Dave Yost, a Republican, and reflects the party’…', 'url': 'https://deadline.com/2021/06/ohio-sues-google-public-utility-1234771448/', 'urlToImage': 'https://deadline.com/wp-content/uploads/2021/06/AP21032628164514.jpg?w=1024', 'publishedAt': '2021-06-08T17:50:50Z', 'content': 'The attorney general of Ohio is asking a state court to declare Google a public utility, something that would subject the search giant to extensive government regulation.\r\nThe lawsuit (read it here) … [+2001 chars]'}"
71,ok,926,"{'source': {'id': 'axios', 'name': 'Axios'}, 'author': 'Kim Hart', 'title': 'Scoop: Conservatives sound alarm against taking Big Tech money', 'description': 'Conservatives in Washington are growing much more leery of groups with financial ties to Big Tech. Driving the news: The American Principles Project, a conservative advocacy group, will send a letter today warning Republican lawmakers and staffers to be aware…', 'url': 'https://www.axios.com/conservatives-alarm-big-tech-money-7d5ed3c3-82fe-40e4-84c9-8d905a14d680.html', 'urlToImage': 'https://images.axios.com/TLFBCzvJoYH1xgH299n_X8WgA0M=/0x0:1920x1080/1366x768/2021/06/04/1622838681367.jpg', 'publishedAt': '2021-06-07T09:00:52Z', 'content': 'Conservatives in Washington are growing much more leery of groups with financial ties to Big Tech. \r\nDriving the news: The American Principles Project, a conservative advocacy group, will send a lett… [+4894 chars]'}"
72,ok,926,"{'source': {'id': None, 'name': 'Middlemarketgrowth.org'}, 'author': None, 'title': 'Antitrust Regulation Could Lead to Uptick in Tech Carve-outs - Middle Market Growth', 'description': 'Lawmakers are expected to take a stronger stance on antitrust practices from big tech companies. Could that spell opportunity for acquirers?', 'url': 'https://middlemarketgrowth.org/the-round-antitrust-regulation-could-lead-to-uptick-in-tech-carve-outs/', 'urlToImage': 'http://middlemarketgrowth.org/wp-content/uploads/2021/06/MMGSpring2021_HeroImage_Antitrust_1280x720px.jpg', 'publishedAt': '2021-06-22T21:28:03Z', 'content': 'If youre starting from tens of billions of market cap and youre selling 10% of your business, youre talking about an $8 billion, $10 billion or $12 billion business, he says. That doesnt look much li… [+2927 chars]'}"
73,ok,926,"{'source': {'id': None, 'name': 'VOA News'}, 'author': None, 'title': ""Biden's New FTC Head Could Make Big Tech Sweat - Voice of America"", 'description': ""U.S. President Joe Biden's unexpected decision to name a staunch antitrust advocate to lead the Federal Trade Commission has thrilled supporters of stronger regulation of the tech industry and has prompted predictions of regulatory overreach from representati…"", 'url': 'https://www.voanews.com/economy-business/bidens-new-ftc-head-could-make-big-tech-sweat', 'urlToImage': 'https://im-media.voltron.voanews.com/Drupal/01live-166/2021-06/AP21166830735954.jpg', 'publishedAt': '2021-06-17T07:08:59Z', 'content': ""U.S. President Joe Biden's unexpected decision to name a staunch antitrust advocate to lead the Federal Trade Commission has thrilled supporters of stronger regulation of the tech industry and has pr… [+6011 chars]""}"
74,ok,926,"{'source': {'id': None, 'name': 'MarTech Series'}, 'author': 'Business Wire', 'title': 'Consumers Feel Big Tech Companies Have Too Much Power and Require More Stringent Regulation - MarTech Series', 'description': 'Nearly two-thirds of consumers in the United States feel big tech companies wield too much power and more than half feel the US government should act to curb their influence. Further, such sentiments are consistent across political party lines. These', 'url': 'https://martechseries.com/analytics/consumers-feel-big-tech-companies-much-power-require-stringent-regulation/', 'urlToImage': 'https://martechseries.com/wp-content/uploads/2021/05/MTS_15-03-2021-5.jpg', 'publishedAt': '2021-06-30T08:40:58Z', 'content': 'Nearly two-thirds of consumers in the United States feel big tech companies wield too much power and more than half feel the US government should act to curb their influence. Further, such sentiments… [+2389 chars]'}"
75,ok,926,"{'source': {'id': 'bloomberg', 'name': 'Bloomberg'}, 'author': 'Matt Levine', 'title': 'Money Stuff: Facebook Is Big But Maybe Not a Monopoly', 'description': 'Yesterday a U.S. federal judge  dismissed two antitrust lawsuits against Facebook Inc., brought by the U.S. Federal Trade Commission and a group of state attorneys general,\xa0claiming that it has a monopoly on social networking. Facebook investors celebrated by…', 'url': 'https://www.bloomberg.com/news/newsletters/2021-06-29/facebook-victory-against-the-ftc-is-an-antitrust-lesson-in-monopoly-power', 'urlToImage': 'https://assets.bwbx.io/images/users/iqjWHBFdfxIU/iDnEoA8BH7Q8/v0/1200x820.jpg', 'publishedAt': '2021-06-29T15:59:12Z', 'content': 'Facebook\r\nYesterday a U.S. federal judge \r\ndismissed two antitrust lawsuits against Facebook Inc., brought by the U.S. Federal Trade Commission and a group of state attorneys general,\xa0claiming that i… [+28634 chars]'}"
76,ok,926,"{'source': {'id': 'national-review', 'name': 'National Review'}, 'author': 'Daniel Tenreiro, Daniel Tenreiro', 'title': 'Facebook Lands a Major Court Victory', 'description': 'A discussion on how Facebook beat regulators in court, House Republicans released a tech-regulation framework, commodities traders are cashing out, and more.', 'url': 'https://www.nationalreview.com/2021/06/facebook-lands-a-major-court-victory/', 'urlToImage': 'https://i2.wp.com/www.nationalreview.com/wp-content/uploads/2020/07/mark-zuckerberg-house-hearing.jpg?fit=1200%2C700&ssl=1', 'publishedAt': '2021-06-29T17:00:04Z', 'content': 'Facebook CEO Mark Zuckerberg testifies before the House Judiciary Subcommittee on Antitrust, Commercial and Administrative Law on “Online Platforms and Market Power” on Capitol Hill, July 29, 2020. (… [+8705 chars]'}"
77,ok,926,"{'source': {'id': None, 'name': 'Charleston Post Courier'}, 'author': 'Franklin McGuire Jr.', 'title': 'Commentary: Beware China when seeking to regulate Big Tech - Charleston Post Courier', 'description': 'In a time of ever-increasing partisanship in Washington, a number of congressional Democrats and Republicans have shown a certain level of unity lately over the issue of domestic technology regulation.', 'url': 'https://www.postandcourier.com/opinion/commentary/commentary-beware-china-when-seeking-to-regulate-big-tech/article_bcf70e8c-d2c8-11eb-86f4-bf84194b7ba4.html', 'urlToImage': 'https://bloximages.newyork1.vip.townnews.com/postandcourier.com/content/tncms/assets/v3/editorial/1/99/19985a7e-d2c9-11eb-93fc-a70285866d3c/60d0ec37bfc12.image.jpg?crop=1430%2C1188%2C10%2C117&resize=758%2C630&order=crop%2Cresize', 'publishedAt': '2021-06-24T19:00:00Z', 'content': 'In a time of ever-increasing partisanship in Washington, a number of congressional Democrats and Republicans have shown a certain level of unity lately over the issue of domestic technology regulatio… [+3038 chars]'}"
78,ok,926,"{'source': {'id': None, 'name': 'Broadbandbreakfast.com'}, 'author': 'Ty Perkins', 'title': 'Regulating Big Tech with State Laws Could Negatively Impact Customers - BroadbandBreakfast.com', 'description': 'Regulating Big Tech with State Laws Could Negatively Impact Customers\xa0\xa0BroadbandBreakfast.com', 'url': 'https://broadbandbreakfast.com/2021/06/regulating-big-tech-with-state-laws-could-negatively-impact-customers/', 'urlToImage': 'https://i0.wp.com/broadbandbreakfast.com/wp-content/uploads/2021/06/Eli-Dourado-scaled-1.jpg?resize=1000%2C600&ssl=1', 'publishedAt': '2021-06-07T20:16:45Z', 'content': 'June 7, 2021Attempts to regulate the technology companies at the state level could end up harming consumers in the long run, according to panelists at an online seminar hosted by NetChoice on Thursda… [+2446 chars]'}"
79,ok,926,"{'source': {'id': 'bloomberg', 'name': 'Bloomberg'}, 'author': 'Joshua Brustein', 'title': ""Lina Khan's Appointment Is Riling the Tech World"", 'description': 'What to expect from the new FTC chair.', 'url': 'https://www.bloomberg.com/news/newsletters/2021-06-16/lina-khan-s-appointment-is-riling-the-tech-world', 'urlToImage': 'https://assets.bwbx.io/images/users/iqjWHBFdfxIU/ihiAS0ZJ_7Qs/v0/1200x800.jpg', 'publishedAt': '2021-06-16T10:45:15Z', 'content': 'Hey, its Josh. As a general rule, new appointments to the Federal Trade Commission dont attract much attention. But the Senate confirmation Tuesday of Lina Khanand the subsequent announcement that sh… [+5066 chars]'}"
80,ok,926,"{'source': {'id': 'axios', 'name': 'Axios'}, 'author': 'Kim Hart', 'title': 'Privacy tech industry explodes - Axios', 'description': 'What was once a cottage industry helping businesses cope with regulation has grown to a multi-billion-dollar sector.', 'url': 'https://www.axios.com/privacy-tech-industry-explodes-52f490ae-e96b-4f1f-abea-13634f5cddef.html', 'urlToImage': 'https://images.axios.com/zQZdVfp9MEkDDr5nTKwkeSYoSJY=/0x0:1920x1080/1366x768/2021/06/09/1623198810682.jpg', 'publishedAt': '2021-06-09T10:00:33Z', 'content': 'Businesses forced to comply with a patchwork of state and global privacy rules have turned what was once a cottage industry focused on data and privacy into a multi-billion-dollar sector. \r\nWhy it ma… [+2698 chars]'}"
81,ok,926,"{'source': {'id': None, 'name': 'Ctvnews.ca'}, 'author': 'Paul R. La Monica', 'title': 'Big Tech is booming again, and the bull run appears to be far from over - CTV News', 'description': ""Investors don't seem all that worried that tech stocks are going to slow down any time soon, despite lingering concerns about increased regulation that lawmakers in America and abroad are trying to impose."", 'url': 'https://www.ctvnews.ca/business/big-tech-is-booming-again-and-the-bull-run-appears-to-be-far-from-over-1.5490329', 'urlToImage': 'https://www.ctvnews.ca/polopoly_fs/1.5490337.1624991979!/httpImage/image.jpg_gen/derivatives/landscape_620/image.jpg', 'publishedAt': '2021-06-29T18:42:00Z', 'content': ""So much for big tech stocks falling out of favor.\r\nFacebook has soared almost 30 per cent this year and Mark Zuckerberg's social media giant is now worth more than US$1 trillion. It's not the only gi… [+3300 chars]""}"
82,ok,926,"{'source': {'id': None, 'name': 'Yahoo Entertainment'}, 'author': 'Daniel Howley', 'title': 'Bipartisan bills targeting America’s tech giants ‘watershed moment for antitrust,’ legal expert', 'description': 'Five new bills could bring about the biggest changes to antitrust laws in 100 years.', 'url': 'https://finance.yahoo.com/news/bipartisan-bills-targeting-americas-tech-giants-watershed-moment-for-antitrust-210734258.html', 'urlToImage': 'https://s.yimg.com/ny/api/res/1.2/F7H95Xz2pp0umAPrBTwpTg--/YXBwaWQ9aGlnaGxhbmRlcjt3PTIwMDA7aD0xMzMz/https://s.yimg.com/os/creatr-uploaded-images/2021-01/ad815ad0-5cd4-11eb-babf-32911ea50395', 'publishedAt': '2021-06-14T21:07:34Z', 'content': 'A raft of recently proposed bills could bring about the biggest changes to antitrust law in 100 years, if theyre passed. The bills, five in total, target Americas tech giants Amazon (AMZN), Apple (AA… [+4219 chars]'}"
83,ok,926,"{'source': {'id': None, 'name': ""Barron's""}, 'author': 'Eric J. Savitz', 'title': ""Lina Khan and the U.S. Senate Are Bringing a New Focus to Tech Regulation - Barron's"", 'description': 'Tech investors have been rewarded for ignoring the noise around potential regulation. Why it’s time to start paying attention.', 'url': 'https://www.barrons.com/articles/tech-regulation-51624056392', 'urlToImage': 'https://images.barrons.com/im-356490/social', 'publishedAt': '2021-06-18T23:46:00Z', 'content': 'If anyone still had questions about President Bidens view on tech regulation, they have now been answered. The president made his position crystal clear this past week by naming Columbia Law School P… [+5385 chars]'}"
